id,subreddit,created_utc,body,link_id,parent_id,score,controversiality,author,is_submitter
nbr3l7g,socialism,1756685019,"When standing by with your defensive forces and letting fascists bully your people, rather than actively helping them beat your people, is seen as ""resisting fascism"".

""We're fighting back by... standing aside and letting them hurt our people. But hey, at least we aren't ALSO hurting our own people!""

JFC",t3_1n520oy,t3_1n520oy,6,0,Explorer_Entity,False
nbr3n20,socialism,1756685037,[removed],t3_1n520oy,t1_nbqwb5u,1,0,[deleted],False
nbr4pi1,socialism,1756685433,"I Love immigration, it helps countries improve. Plus I like all the different cultures that are introduced ex. When Latino, Asian and African etc people coming to America and introducing all these foods and styles etc. I love immigrants and I myself am a legal immigrant :-)",t3_1n54ajd,t3_1n54ajd,2,0,Fit-Key-6537,False
nbr4uoq,socialism,1756685484,Omg I love that sign! :-),t3_1mq2o02,t3_1mq2o02,1,0,Fit-Key-6537,False
nbr5rpp,socialism,1756685822,"This is a space for socialists to discuss current events in our world from anti-capitalist perspective(s), and a certain knowledge of socialism is expected from participants. **This is not a space for non-socialists.** Please be mindful [of our rules](https://reddit.com/r/socialism/about/rules) before participating, which include:

- **No Bigotry**, including racism, sexism, homophobia, transphobia, ableism...

- **No Reactionaries**, including all kind of right-wingers.

- **No Liberalism**, including social democracy, lesser evilism...

- **No Sectarianism**. There is plenty of room for discussion, but not for baseless attacks.

Please help us keep the subreddit helpful by reporting content that break r/Socialism's rules.

______________________

&#128172; Wish to chat elsewhere? Join us in discord: https://discord.gg/QPJPzNhuRE
    


*I am a bot, and this action was performed automatically. Please [contact the moderators of this subreddit](/message/compose/?to=/r/socialism) if you have any questions or concerns.*",t3_1n5acl3,t3_1n5acl3,1,0,AutoModerator,False
